<?xml version="1.0" encoding="UTF-8"?>
<emt:estacion xmlns:emt="https://api.mobipalma.mobi/docs/" 
			  xmlns:xsi="http://www.w3.org/2001/XMLSchema-instance" 
			  xsi:schemaLocation="https://api.mobipalma.mobi/docs/ estacion.xsd ">
  <id>1</id>
  <direccion>Manacor 50</direccion>
  <numeroAnclajes>10</numeroAnclajes>
  <anclajes>
    <bicicleta>250</bicicleta>
    <bicicleta>270</bicicleta>
    <bicicleta>290</bicicleta>
    <bicicleta>null</bicicleta>
    <bicicleta>null</bicicleta>
  </anclajes>
</emt:estacion>
